{
	"name": "Emergency Record",
	"description": "Emergency record defined by gematik (cf. [gemSpec_Info_NFDM])",
	"guidelineDefinition": {
		"url": "https://fachportal.gematik.de/"
	},
	"folderCardinality": {
		"min": "1",
		"max": "1",
		"unique": true
	},
	"validFromDate": "2021-06-15",
	"type": "atomic",
	"metadata": {
		"name": "folder.codeList",
		"value": {
			"code": "nfd",
			"codeSystem": "1.2.276.0.76.5.512",
			"displayName": "Notfalldaten",
			"desc": [
				{
					"language": "de-DE",
					"#text": "Daten der elektronischen Notfalldaten nach § 334 Absatz 1 Satz 2 Nummer 5 und 7"
				}
			]
		}
	},
	"elements": [
		{
			"name": "Emergency Record",
			"description": "This document is an XML-based document.",
			"metadata": [
				{
					"name": "documentEntry.classCode",
					"value": {
						"code": "AUS",
						"codeSystem": "1.3.6.1.4.1.19376.3.276.1.5.8",
						"displayName": "Medizinischer Ausweis",
						"desc": [
							{
								"language": "de-DE",
								"#text": "Ausweise, Pässe und ähnliche kurze Datensätze, die wichtige medizinische Informationen zusammenfassen. Beispiele: Allergiepass, Allergieausweis, Impfpass, Impfausweis, Impfbuch, Notfalldatensatz"
							}
						]
					}
				},
				{
					"name": "documentEntry.formatCode",
					"value": {
						"code": "urn:gematik:ig:Notfalldatensatz:r3.1",
						"codeSystem": "1.3.6.1.4.1.19376.3.276.1.5.6",
						"displayName": "Notfalldatensatz"
					}
				},
				{
					"name": "documentEntry.mimeType",
					"value": [
						"application/xml"
					]
				}
			],
			"documentCardinality": {
				"min": "0",
				"max": "n"
			}
		}
	]
}
