{
	"name": "Telemedical Monitoring",
	"description": "Telemedical Monitoring defined as a medical information object (MIO) by KBV.",
	"guidelineDefinition": {
		"url": "https://mio.kbv.de/display/tm",
		"version": "1.0"
	},
	"folderCardinality": {
		"min": "1",
		"max": "1",
		"unique": true
	},
	"validFromDate": "2023-01-01",
	"type": "atomic",
	"metadata": {
		"name": "folder.codeList",
		"value": {
			"code": "other",
			"codeSystem": "1.2.276.0.76.5.512",
			"displayName": "in andere Kategorien nicht einzuordnende Dokumente, eDMPs sowie Telemedizinisches Monitoring",
			"desc": [
				{
					"language": "de-DE",
					"#text": "sonstige von den Leistungserbringern für den Versicherten bereitgestellte Daten, insbesondere Daten, die sich aus der Teilnahme des Versicherten an strukturierten Behandlungsprogrammen bei chronischen Krankheiten gemäß § 137f ergeben"
				}
			]
		}
	},
	"elements": [
		{
			"version": "1.0",
			"name": "KBV_PR_MIO_TELE_Bundle",
			"description": "This document is a telemedical monitoring record and describes summaries of measured values ​​and courses of therapy.",
			"canonicalUrl": "https://fhir.kbv.de/StructureDefinition/KBV_PR_MIO_TELE_Bundle",
			"metadata": [
				{
					"name": "documentEntry.classCode",
					"value": {
						"code": "DUR",
						"codeSystem": "1.3.6.1.4.1.19376.3.276.1.5.8",
						"displayName": "Durchführungsprotokoll",
						"desc": [
							{
								"language": "de-DE",
								"#text": "Maschinell oder von Menschen erstellte Protokolle durchgeführter Anamnese, Diagnostik oder Therapie, z.B. Anamnesebogen, OP-Berichte, Medikamentenverabreichungen; hierzu zählen auch ausgefüllte Checklisten die das prozesskonforme Vorgehen während einer Untersuchung oder OP dokumentieren. Die Protokolle können auch Handlungsanweisungen bzw. Empfehlungen beinhalten, z.B. Visitenprotokoll, Konsilbericht. Dazu gehören auch Messdaten (oft auch als Quelldaten oder Rohdaten bezeichnet) ohne menschliche Bewertung wie Temperaturkurven, Blutdruck-Messungen, Blutzuckerkurven, unbefundete EKGs, Herz-Tonaufnahmen, Bestrahlungsprotokoll, Dosiswerte, etc. mit Ausnahme von Bilddaten und Videodaten. Der Begriff 'Patientenkurve' wird in einigen Fällen für eine Sammlung von Temperatur-, Blutdruck- und weiteren pflegerischen Beobachtungen verwendet und sollte dann auch über das Konzept DUR ('Durchführungsprotokoll') abgedeckt werden. Da der Begriff 'Patientenkurve' auch für andere Dokumente (bzw. Dokumentenkombinationen) verwendet wird, sollte vor einer solchen Abbildung eine Analyse der so bezeichneten Dokumente durchgeführt und das entsprechende Konzept verwendet werden. Dokumente die mit diesem Konzept bezeichnet werden können maschinenlesbar sein, müssen es jedoch nicht (z.B. sowohl EKG-Kurve wie auch eingescanntes EKG sind abgedeckt). Ursprungs- und Zwischenformate (wie z.B. Diktat eines Arztbriefes) werden mit dem inhaltlich sinnvollen classCode gekennzeichnet (Brief in diesem Beispiel)."
							}
						]
					}
				},
				{
					"name": "documentEntry.formatCode",
					"value": {
						"code": "urn:gematik:ig:Telemedizinisches-Monitoring:v1.0",
						"codeSystem": "1.3.6.1.4.1.19376.3.276.1.5.6",
						"displayName": " Telemedizinisches Monitoring (gematik)"
					}
				},
				{
					"name": "documentEntry.mimeType",
					"value": [
						"application/fhir+xml"
					]
				}
			],
			"documentCardinality": {
				"min": "0",
				"max": "n"
			}
		}
	]
}