{
	"name": "Patient Summary",
	"description": "Patient summary defined as a medical information object (MIO) by KBV.",
	"igVersion": "1.0.0",
	"guidelineDefinition": {
		"url": "https://mio.kbv.de/display/PKA1X0X0",
		"version": "1.0.0"
	},
	"folderCardinality": {
		"min": "1",
		"max": "1",
		"unique": true
	},
	"validFromDate": "2023-07-01",
	"type": "atomic",
	"metadata": {
		"name": "folder.codeList",
		"value": {
			"code": "nfd",
			"codeSystem": "1.2.276.0.76.5.512",
			"displayName": "Notfalldaten",
			"desc": [
				{
					"language": "de-DE",
					"#text": "Daten der elektronischen Notfalldaten nach § 334 Absatz 1 Satz 2 Nummer 5 und 7"
				}
			]
		}
	},
	"elements": [
		{
			"version": "1.0.0",
			"name": "KBV_PR_MIO_NFDxDPE_Bundle",
			"description": "This document is of FHIR resource type KBV_PR_MIO_NFDxDPE_Bundle.",
			"canonicalUrl": "https://fhir.kbv.de/StructureDefinition/KBV_PR_MIO_NFDxDPE_Bundle",
			"metadata": [
				{
					"name": "documentEntry.classCode",
					"value": {
						"code": "AUS",
						"codeSystem": "1.3.6.1.4.1.19376.3.276.1.5.8",
						"displayName": "Medizinischer Ausweis",
						"desc": [
							{
								"language": "de-DE",
								"#text": "Ausweise, Pässe und ähnliche kurze Datensätze, die wichtige medizinische Informationen zusammenfassen. Beispiele: Allergiepass, Allergieausweis, Impfpass, Impfausweis, Impfbuch, Notfalldatensatz"
							}
						]
					}
				},
				{
					"name": "documentEntry.typeCode",
					"value": {
						"code": "BEFU",
						"codeSystem": "1.3.6.1.4.1.19376.3.276.1.5.9",
						"displayName": "Ergebnisse Diagnostik",
						"desc": [
							{
								"language": "de-DE",
								"#text": "Dokumentation zur Planung und Durchführung von Radiotherapien, einschließlich der ausgefüllten Anamnese- und Aufklärungsbögen zur Bestrahlungstherapie.Beispiele: Bestrahlungsplan, Bestrahlungsprotokoll, Bestrahlungsverordnung, Radiojodtherapieprotokoll, Therapieprotokoll mit Radionukleiden, Brachytherapieprotokoll, Bericht zur interventionellen Radioonkologie"
							}
						]
					}
				},
				{
					"name": "documentEntry.formatCode",
					"value": {
						"code": "urn:gematik:ig:pka:v1.0",
						"codeSystem": "1.3.6.1.4.1.19376.3.276.1.5.6",
						"displayName": "Patientenkurzakte (gematik) v1.0"
					}
				},
				{
					"name": "documentEntry.mimeType",
					"value": [
						"application/fhir+xml"
					]
				}
			],
			"documentCardinality": {
				"min": "0",
				"max": "1"
			}
		}
	]
}
