{
	"name": "Research Data Submission Tracking",
	"description": "Detailled record of submitted and withdrawn (if applicable) pseudonymous documents for research purposes.",
	"igVersion": "1.0.1",
	"guidelineDefinition": {
		"url": "https://github.com/gematik/api-ePA/blob/2.5.1/src/implementation_guides/researchDataSubmissionTrackingList.json",
		"version": "1.0.2"
	},
	"folderCardinality": {
		"min": "1",
		"max": "1",
		"unique": false
	},
	"validFromDate": "2023-01-01",
	"type": "atomic",
	"metadata": {
		"name": "folder.codeList",
		"value": {
			"code": "technical",
			"codeSystem": "1.2.276.0.76.5.512",
			"displayName": "Technische Dokumente",
			"desc": [
				{
					"language": "de-DE",
					"#text": "Technische Dokumente, die nicht für Leistungserbringer berechtigt und einem Versicherten oder Vertreter nicht direkt im ePA-FdV zur Anzeige gebracht werden"
				}
			]
		}
	},
	"elements": [
		{
			"version": "1.0.0",
			"name": "Aufzeichnungsliste Datenfreigabe Forschung",
			"description": "This document is a detailed record of all pseudonymous documents submiited to a research data center for medical research data analysis",
			"canonicalUrl": "https://github.com/gematik/api-epa/src/sharedResearchData/researchDataSubmissionTrackingList.json",
			"metadata": [
				{
					"name": "documentEntry.classCode",
					"value": {
						"code": "ADM",
						"codeSystem": "1.3.6.1.4.1.19376.3.276.1.5.8",
						"displayName": "Administratives Dokument",
						"desc": [
							{
								"language": "de-DE",
								"#text": "Anträge, Aufklärung, Bescheinigungen; auch juristische Dokumente, Vereinbarungen und Verträge; Anmeldungen, Regelungen, Einwilligungen, Bestellungen, Rechnungen, Bescheide, Anordnungen (im juristischen Sinne), Aufträge, Ausweise (außer medizinische Ausweise wie Impfpässe, siehe Konzept AUS ('Medizinischer Ausweis')), Meldungen, Qualitätssicherungsdokumente"
							}
						]
					}
				},
				{
					"name": "documentEntry.formatCode",
					"value": {
						"code": "urn:gematik:ig:researchDataSubmissionTracking:v1.0",
						"codeSystem": "2.25.154081344090540725127779452347992051720",
						"displayName": "Aufzeichnungsliste Forschungsdatenfreigabe"
					}
				},
				{
					"name": "documentEntry.mimeType",
					"value": [
						"application/json"
					]
				}		
			],
			"documentCardinality": {
				"min": "0",
				"max": "1"
			},
			"maxDocumentHistory" : 10
			
		}
	]
}
